o	Suzy reached the exam centre on time. She	danced her way to her room.	bought tofu for the night's dinner	met her friends at the gate.	went back home from the centre	2
o	Police received word of a burglary nearby. They	run in and steal items.	bring expensive items as replacements.	start investigating the family dog.	started driving to the location.	3
o	Harry Potter uttered the words of an invisibility spell and waved his wand at Hermione. She	drew her wand and pointed it at him.	shrunk down to the size of a rat.	turned translucent and disappeared.	said that she couldn't talk now.	2
q	ten minus nine is	eight	ten	nine	one	3
o	Sachin was considered the best batsman in the world when he retired last year. People	will miss watching him bat.	will miss watching him bowl.	will watch him bat next year.	hate watching him bat.	0
r	A dog walks into a lecture hall. It	gives a lecture.	teaches the class.	lies in the front.	speaks into a microphone.	2
n	I am tall enough to play basketball. I	joined a basketball team.	am not short.	am good at playing basketball.	love playing basketball.	1
o	A group of people is walking outdoors and are preparing to run in a race. They	get back in their cars	take a nap	run down city streets and wave to the crowd watching them.	run away from the bear.	2
n	The lion was on the lookout of a prey. He	submits to the will of the lioness	was interrupted by the large caravan going by	was friendly to people	had never tasted blood all his life	1
o	A dentist hands his patient a toothbrush. He	also hands them dental floss, says to make potato salad, and to stir it with the toothbrush	tells them they have cavities, consumes a tooth, and throws the toothbrush.	grabs toothpaste, squirts it on his computer, and throws away the toothbrush.	reminds them to use it twice a day.	3
o	People learn second languages because	they want to talk to their parents.	they are interested in them.	they got nothing better to do.	people forget a language every year so they need to learn a new one so they can talk.	1
o	The dog is barking at a thief. The thief	run to the dog and bite the dog	is scared away	is laughing	likes the dog	1
o	Anne turned 13. She wore a beautiful dress and was surrounded by her friends and family. She ate a	carrot cake,	birthday cake.	wedding cake.	hot dog.	1
o	The word khaki originates in India and refers to a certain type of material. As a loan word, in English khaki means	that's right sucker.	Midwestern weather sucks.	let's go on a strike!	a color and a type of pants.	3
o	Quincia is helping me with my machine learning homework. To thank her, I	tell her I have cancer.	offer to assist her in some other endeavor.	throw all the papers up in the air and scream "this is hopeless!"	never speak to her again.	1
o	A man's cat won't eat his food after surgery. The man should	put the cat outside.	call the vet.	cook the cat into his favorite food.	get a new, better cat.	1
i	A parent is angry at a child for breaking a vase. The parent	trades the child for a vase	lets the child break another vase	punishes the vase for breaking the kid	lets the child off the hook with a warning	3
o	The dog is chasing the cat. The cat	is trying to find the cat food.	is sharing a meal with the dog.	is hunting a mouse.	is terrified.	3
o	For the holidays, I eat a lot of food. I	donated a sweater	planted a flower	love gingerbread cookies best	lost weight	2
o	Mary scrolls through her Facebook newsfeed. She	likes a picture of an elephant.	throws her phone on the ground.	laughs at a eulogy post.	picks up a piece of paper.	0
o	My parents bought are purchasing an air conditioner in the store. I	will play better at basketball.	will drive to work today.	will feel good in the summer.	will study harder at school.	2
o	Bill loves his Mac and so does Andrew. But Andrew	is looking for revenge	took it apart	also has a PC	loves Bill	2
o	A bird sings in the woods. He	is scared of the new housecat.	is looking for a mate.	doesn't like being trapped in a cage.	is migrating north for the winter.	1
n	He wasn't irresponsible about his duties, so he was	responsible	not responsible	lazy	irresponsible	0
r	A girl walks her dog around her neighborhood. She…	then laps up water from the faucet	then goes to the park	wags her tail	catches the frisbee in her mouth	1
o	Janice fights with her sister. Janice	throws a mountain at her sister	drinks nitro	punches her	sisters her fight attack	2
o	A car drives on a long highway for one hundred hours without stopping. The car	can fly.	has flat tires.	has no driver.	is a solar car with batteries for the night.	3
o	I started up the steps to the front door of 326 East Sixty-ninth Street, then realized I couldn't make it with both bags and my violin. Leaving one bag on the sidewalk, I	brought more bags and started playing the violin	nothing	dragged the other up the steps with me	nothing	2
o	The boy thought he bought his a dad a brand new office chair for christmas. The boy	took the chair apart.	set the chair on fire.	realized it was used.	painted the chair.	2
o	Jimmy felt that his hands were sticky. He	washed them with glue.	pasted them onto a wall.	rinsed them in the sink.	showered under a waterfall.	2
o	The right-leaning man didn't like the left wing. He	flew his plane unevenly.	always gave the right wing presents.	would never vote for a progressive.	bought a company that manufactured right wings.	2
o	Kelly went bananas. She	bought some fruits at a market.	ordered a fruit milk shake.	walks to her car.	jumped over the table.	3
o	A dog stares out the window. He	wants to write messages in the window fog.	sees the neighbors across the street and wants to say hi.	is waiting for the mailman to bring him his paycheck.	is longing for the better days of his youth.	1
p	A man places a basket of fruits on the table. He	smashes the basket with a gallon of milk.	wishes his family would eat better.	is the fruit of a happy marriage.	will wait for the basket to ripe and become froot loops.	1
r	A team of anthropologists uncovers a mummy in a tomb. The mummy	performs an anthropology experiment.	thanks the anthropologists.	doesn't move.	congratulates the anthropologists.	2
o	The dog excitedly jumped out of the car window as they pulled up to the dog field. The dog	likes being a dog.	owns the field.	then sprinted towards his friend.	hates the field.	2
o	I am getting gas in my car. I	drive away from the gas station.	look for the cheapest option.	realize I have to buy a car first.	put the gas nozzle in my mouth.	1
o	The florist needed to find a new supplier of daisies. The florist	picked sunflowers on their walk home.	sold sophisticated floral arrangements  in her store.	took a trip to Florida.	used the phone book to find some new contact information.	3
r	Sam lives in America and is talking on an international call with Joe, who is a Canadian. Sam	lives in Mumbai, India.	lives in America.	lives in Canada.	lives in Chicago.	1
o	Peanuts are nuts, all nuts are food. Peanuts	are rubbish.	are not food.	are not nuts.	are food.	3
o	A group of dogs are running around a race track. The leader	digs in for the home stretch.	digs in the sand playfully.	computes the derivative of the inside function.	catches a frisbee in its mouth.	0
o	Justin is at a swimming race and gets ready. He	can't wait to start jumping into the pool	swims into his dreams	waits for the start sound and prepares	waits for his mom to watch him swim	2
p	the presentation is a bomb. the presentation	is really bad	is awesome.	tells a story about bomb.	cause bomb	1
o	The girl just finished a chemistry lab at her university. She	is seven years old and wants to be a scientist when she grows up.	starts cooking dinner on the Bunsen burner.	goes to write the report.	is wearing a swimsuit.	2
o	I trained my parrot to fix my resume. He	referred me to a coworker of his who specialized in economics.	told me to organize a portfolio of my past works.	just repeated what I said to it.	helped me get many job offers.	2
o	I used a telescope with	under the planet’s surface.	something that is close.	something far away.	a lens.	3
o	The child went out for his first halloween. He	got candy	bought some spiderwebs	went to class	got coffee	0
o	I am a student studying journalism at Northwestern University. I	can't wait to buy a new house.	will find that the steak is too raw.	am going to take a class on nuclear physics.	write an article for a course	3
o	Tina wants to improve her Math grades. Tina	spends a lot of time playing games.	never attends class.	works hard.	likes shopping.	2
o	Today my classmate asked an intriguing question. He	has a deep understanding of the material.	is really good at soccer.	is secretly the teacher.	stood upside down.	0
o	An author types away at his keyboard. He	prints out his work to check the grammar.	says to the customer, "Do you have a membership card with us?"	throws a frisbee with his son.	pulls into the left-turn lane and puts his blinker on.	0
o	Rose tucks her two children in for bed. She	kisses all three of them goodnight.	wishes she had children.	reads both of them a bedtime story.	has only one child.	2
o	Sarah showed up late for her interview. The	resume submitted her.	alarm wasn't set properly.	interviewer was so impressed by her.	job wasn't for her.	1
o	A woman is making a tequila sunrise. After putting ice in the glass, she	watches the sun rise on the beach.	mixes in liquor and juice.	puts ice in the glass.	pours the ice out of the glass.	1
o	A banker sat in the courtroom. She	ate an expensive banana.	counted her money and opened a savings account.	was indicted for defrauding customers.	spun around three times and cast a spell.	2
r	Bob tells his best friend Sally that he has a crush on her. She	decides she has to do her homework.	has a heart attack.	starts screaming because she actually hates him.	smiles.	3
o	Kelly is decorating her house and wants to jazz things up a bit. She	adds in some flower pots.	goes to a jazz club.	loves the 80s.	bought a saxophone.	0
r	An old man rides a small bumper car. Several people	are minding their own business.	get in the parking lot.	are watching him maneuver his car smartly.	are trying to take him out and fly away in his car.	2
o	A boy has three yellow objects. They	are eggplants.	are blades of grass.	are bananas.	are footballs.	2
o	He dribbles the basketball carelessly. An opposing player runs towards him and	dives.	steals the ball.	trips and falls.	tackles him.	1
o	The exam went horribly. I didn't even know	what my name was	who was in my blind-spot on the road	what I ate for breakfast	how to compute the derivative	3
o	The toddler enters the baseball stadium in a pram. She	swims a mile.	runs a mile.	looks delighted at posters.	hits a home run.	2
o	The girl jogs across the field as a soccer ball rolls toward the opponent's goal. The girl	does a victory dance because she has scored a goal.	leaves the field to get a drink of water from her water bottle.	receives a trophy for winning the game.	sprints to the ball and scores a goal.	3
o	A man is walking to the store to purchase flour for a cake that he is baking. He	mixes all of the ingredients in a bowl and puts them into the oven.	goes outside to pick flowers.	jumps across the busy highway.	finds the aisle and purchases a pound of it.	3
o	Someone examines herself in the mirror and smiles. Sitting on her bed, she	pours as the heroes even lighter.	tugs out her bonds.	stuffs her chair under the sink and looks through it.	glances at the alarm clock.	3
p	The man is at the podium of a spelling  bee. The man	kills all the bees.	presents the prize.	gives honey to all the children.	loves to eat honey.	1
o	The trophy did not fit in the bag. The trophy	was too heavy.	was too small.	was too gold.	was too big.	3
q	A woman owns one cat and two dogs. She	needs to feed all five pets everyday.	needs to feed all four pets everyday.	needs to feed all three pets everyday.	needs to feed all two pets everyday.	2
o	A gamer cracks his knuckles and looks at his tv. The gamer	looks at a road sign and follows it.	screams for help.	takes a bite from his hand.	picks up his controller.	3
o	The parched man could not find any water in the desert. He	ordered a soda at the vending machine	drank two gallons of water	collapsed	decided to eat some sand	2
o	I have a younger brother. He	is my favorite son.	does not have any siblings.	will be five when I am eight.	will be eight when I am five.	2
o	A man leaps through the air as the hurdle passes below him. The man then	calls his mom to tell her he is in a hurdling race.	lands on the track and stays in his lane attempting to edge past the other racers.	calls his mom to tell her he likes to leap.	calls his mom and tell her he just jumped a hurdle.	1
r	A man in red and white runs down a track and performs a high jump. The camera	is lowered and covered by a hand.	follows the athlete.	goes to the table and lands in time.	sprints down the track.	1
o	Molly was very hungry when she left work at the end of the day. Thus, Molly	ate her books.	ate her arm.	stopped at the grocery store.	ate her car.	2
o	A cat died in a car crash. His owner	felt sad for himself.	was angry at the perpetrators.	celebrated for the cat.	cried for the dog.	1
o	Thomas hates dogs. He goes to the animal shelter to adopt	a beagle.	a cat.	a husky.	a dog.	1
r	I observed the gymnast eating a donut in the park. I	did a backflip into the bakery and demanded that I have the same donut.	knew something was fishy when he grew to be ten times the size of a normal human.	did a flip off of a balance beam, landing perfectly.	asked him where he got it.	3
n	i forgot to bring my computer so i can not see your	programming course	gift	email	operating system	2
i	In the heat of the moment, he unfortunately	decided to go to Florida	made the wrong decision	went to sun	felt very good	1
n	I hardly have no money because I	am never rich	always have no money	am rich	am not rich	2
o	Although Tom was overwhelmed and thought that reading a thousand pages a week was unimaginable, he	was sent to the hospital because he became crazy.	shredded the books and burned them.	left school and found a job.	finished the task finally.	3
o	A hungry boy is greeted by a very friendly man. The boy	is told to stop being hungry by the man.	is given food and some money by the man.	is told to get lost by the man.	is harassed by the man.	1
	Kelly is a potato couch. She	needs to exercise more often.	rolls around.	recommended me this pretty couch.	is buying chips.	0
n	If Marry exercised every day, marry would be so fit. Marry	is fit.	is not fit.	does not exercise.	eats a lot.	1
o	I am on a walk in the park in the winter.	I pull my hat down over my ears.	I lay in the grass and bathe in the sun.	I look around and smell the flowers.	I stare at the leaves on the trees.	0
n	Unlike Bob, Sarah is smart. Bob	is smart.	is beautiful.	is unlikely.	is stupid.	3
o	A girl is reading a book on unicorns on her porch. The girl	flies through the door.	sees a unicorn in her backyard.	is approached by a fairy.	decides she likes dragons better.	3
o	The construction worker was reprimanded for not wearing his hard hat. He	understood the stupid risk he took.	wore it to the Oscar's afterparty.	wanted to let his hair flow down the tower.	forgot that his hat was at the game.	0
o	A group of children play in the middle of the street with the fire hydrant spraying. The firemen	wanted them to stay cool.	rescue a cat from a tree.	are shooting a calendar for a fundraiser.	help to put out the forest fire.	0
o	Steve said the test was easy. This caused Larry to	get a haircut.	study less.	kiss Steve.	eat the test.	1
o	Tina likes swimming, but it is freezing outside. Tina	sunbathes in the yard.	stays in home.	swims outside.	wears a bathing suit.	1
o	Bob was playing video games when he was supposed to be studying and heard his parents come home. Bob	stuffed himself full of cake.	will buy a lot of video games tomorrow.	threw the game controller out the window.	ran to his textbook.	3
o	Ketchup dates back as far as 1600 AD, when sailors traveling to China discovered a sauce called ketsiap. It	quickly changed ingredients to include mashed cotton and sweet pepper.	was made out of soy or oysters and didn't contain tomatoes.	began the transformation to today's sweet potato in the late 1700s.	was easy to make ketchup boats during that time.	1
p	The sun is frying me. I	want fries.	rolls on the ground.	will go to a fast food stand.	need sunscreen.	3
o	The family has a picnic. They	catch a squirrel for lunch.	eat sandwiches.	cut down an apple tree.	ask the waitress for two salads.	1
o	The printer got jammed after printing 20 documents at once. The printer	printed 20 more documents	documented the jam	likes toast with its jam	needs fixing	3
o	He is one of the famous singers in my country. He	could not sing very well.	may sing in a terrible way	could not sing in the midnight.	is not only a composer but a dancer.	3
p	A woman decided to check the weather. She	asked her TV to ask the local weatherman.	wrote out a check to it.	Looked outside to see the temperature.	checked her app.	3
o	John did not want to socialize with the other students, so he	performed well in his classes.	joined a student club.	went to a party.	sat at home alone.	3
o	The man was reading a book in the park. He	paused his movie.	was sitting on the ground.	parked his car on the book.	fought his librarian for her mercedes.	1
o	It was Christmas Eve and in the North Pole, Santa was	petting a camel.	getting ready to hibernate.	eating Rudolph's daughter for dinner.	loading his sleigh.	3
o	A fish swims in circles around its small tank. The fish	swims upstream.	does another lap.	is delicious.	are delicious.	1
o	Bob and his wife have a huge fight. That night, Bob	runs away from home.	rolls around in the grass.	sleeps on the couch.	peels an orange.	2
o	Ellie goes to the mall. Ellie	goes to the mall with dead Abe Lincoln.	rides her dog to the mall.	counts to 50.	buys a bag.	3
o	A girl starts hormone treatment. She	is thinking about going to school to become a police officer.	is transitioning.	wants to be on stage.	feels claustrophobic.	1
o	Rose is walking around her house looking for her pet cat. Rose	has no pets.	has a collar around her neck in case she gets lost.	is worried.	likes to play with yarn.	2
r	A large group of photographers watch and take photographs of the gymnast. The gymnast	is seen performing a game routine in front of the marching band.	stands on the hula bars and attempts back flips and jumps in the air.	chases after the gymnast and spins with the rake.	waves while spinning in a circle and then runs to the side of the gym floor.	3
o	A dog runs across a field as a frisbee flies through the air. The dog	Curls up next to the fire	Jumps, spins, and twirls	Is pooping on the ground	Goes and catches the frisbee	3
r	All my siblings are nice except Rob. Rob	is kind to me.	is always nice to me.	annoys me a lot.	is very sweet to me.	2
r	The girl confessed her love to the boy. The boy	came clean about how he ate all the cookies	ran downstairs to open the door	ran to his room to check the letters to see whether or not he was rejected	gave an indefinite response about his feelings	3
o	we are from different countries, i am from china and she is from	japan	china	beijing	shanghai	0
o	The girl rides the horse as fast as she can. She	puts on her blinker and merges onto the freeway.	pets her dog every hour, religiously.	has to reach her parents' house by midnight.	plays catch with her friend.	2
p	I fell for this girl I met last weekend. She	wasn't interested.	picked me up	attacked me.	ran away.	0
n	I like all chocolates except Toblerone. I	hate Toblerone.	Love Toblerone.	like trees.	like Northwestern.	0
i	I have a paper thin blanket over me. It	is not too warm.	feels extremely warm.	makes me some hot chocolate.	holds paper.	0
o	The man enter his house. The man	can't find the keys to unlock the door.	goes to school at his university.	eats the garbage.	takes his shoes off.	3
o	The dog in the park barked at the intruder. The dog	chased a squirrel.	dug a hole in the park.	ran up to him.	chased his tail.	2
q	Tom is in first place and 11 people pass him. Tom	is in 1st place	in the lake	is in twelfth	is in 11th place	2
o	Brian is going on a date with Jacob, Jenny's brother. Jenny	is happy to see them together.	is two years younger than Jacob.	likes to go on dates with people.	is going on a date with another Brian.	0
p	Two kids are at the park. They	jump rope.	park their cars and go inside.	don't know how to parallel park.	go swimming in the sandbox.	0
p	There was a crane by the lakeside. The crane had	a phone.	a computer in it.	beautiful feathers.	a man operating it.	2
i	Sally asked Tom not to have a cow, but Tom	could not help but overreact.	desired nothing more than large mammals.	hates Sally.	needs cows in his life.	0
o	Jenny is a famous clothing designer and model. She	is an expert in her field.	is not beautiful.	is an assistant to famous clothing designers and models.	has bad body image.	0
o	The medical diagnostic test came back negative. The patient	is relieved.	wrote a bad essay.	took an examination.	answered correctly.	0
o	I tried to maintain the facade that I had not lost my job. My father	saw through the ruse.	offered to give me his hammock.	told me to walk our three-headed dog.	took my temperature with telekinesis.	0
i	Sally gave Monica the cold shoulder after she made fun of her last week. Sally	ignored Monica.	was cold and covered her shoulders to keep herself warm.	hung out with Monica.	had fun with Monica.	0
o	Bob is playing squash with his girl friend and decides to get dinner. He	starts texting his girl friend.	makes a meal with his dog.	buys squash and makes a meal out of it.	eats his racket.	2
o	Ellie got fired. Ellie	dies in a fire	starts a forest fire	looks for a new job	eats fire	2
n	The dog cannot bark. The dog	gets surgery for its throat.	barks quietly.	barks loudly.	barks.	0
o	A man vacuums his carpet. His	parents are visiting soon	living room couch is very comfortable.	apartment has very reasonable rent.	windows are very dirty.	0
o	Joseph is short. He	is tall.	is under 5 feet.	has no hair.	is not athletic.	1
o	Woman is laying on the floor doing abs. the woman	is doing static bike on the floor.	looks around and wraps her baton around the neck.	smiles and stands in front of a car.	is in a guitar with her dog.	0
o	After a long day of work, Frank just wanted to sit on the couch and watch TV. As he sat down and picked up the remote	he heard his kids calling his name for homework help so he ran and hid.	the TV picked up the remote.	the chair picked up the TV.	the tv picked up the chair.	0
o	I woke up for breakfast. My dad was cooking this morning. I could smell	the flowers in the town park	the bacon	carbon monoxide	the tension	1
o	A man hangs at the edge of a cliff. He	does a pull-up with one finger.	falls down on purpose.	climbs up back onto the ledge.	jumps up onto the top of the Mt. Everest with a single leap.	2
o	Down by the bank, there were many turtles. They	need money from the locked car.	want my great grandma's pie recipe	will take my best friend.	want food from my bag.	3
o	Two leaves fall into the stream. The water	drips from the faucet.	is starting to boil the pasta.	makes the road very slippery.	flows around the rocks.	3
i	Ted was on cloud nine after his date. He	had climbed a very long ladder to get this high.	had not been this happy in a very long time.	was on a flight back home to Vermont.	did not like the other eight clouds.	1
o	The lion attacks the deer. The lion	is wounded.	dies.	bites its neck.	battles the deer for hours.	2
o	I applied to Northwestern University. They	offered to pay for my tuition in full provided I solved P vs. NP by the end of my undergraduate studies.	accepted me because I bought the rights to the land where the University is located.	accepted me because I stood out from the other applicants.	accepted me because I had the exact same DNA as one of the original founders.	2
o	I can't believe that after waking up, all he wanted	after drinking coffee was a glass of orange juice.	to do was wake up.	was a hearty chuckle.	was more sleep.	3
o	The man had to wait in line on a customer service call. He	called on other customers to call on his wife.	was trying to sleep.	serviced his car.	was holding for a long time.	3
o	A group of sailors are in a race yacht and there is a massive storm. They	watch the beautiful calm waters of the Pacific Ocean.	try to balance the boom and the mainsail.	prepare the fishing equipment to catch fish.	watch the beautiful sunset on the hull.	1
o	A man is sitting on a park bench peeling a banana.  He	throws the peel hundreds of yards away.	re-affixes the peel and returns the banana to the grocery store.	tosses the peel into the trash can and begins eating.	eats the peel and sets the banana on fire.	2
q	The children divided 5 by 5. They held up	1 finger.	eleven fingers.	13 fingers.	12 fingers.	0
i	While recognizing that he lived in a dog-eat-dog world, John nonetheless	was not comfortable being ruthless.	did not own a pet.	felt compelled to lie to the police.	had no appetite for dog.	0
o	Joseph wants to know the harm of smoking cigarettes. He	knows the harm of smoking cigarettes.	asks cigarettes about the harm of smoking cigarettes.	goes out and tries smoking a cigarette.	does research on the effects of tar.	3
n	Tina can not cook. Tina	plans to cook a meal for her mother.	can cook.	cooks a big meal for her friends.	always goes to restaurants to have dinner.	3
o	Martha is making breakfast. Martha	eggs her house	cooks up a hot track in the studio	beats some eggs	eggs her kitchen	2
o	The large, strange dog tackled the man from behind. The man	caught fire.	backflipped three times and entered the olympics.	covered his head and rolled up in a ball.	pet the dog.	2
